{
  "protocol": "tmux-observer.action.v1",
  "schemaVersion": 1,
  "requestId": "fixture-kill",
  "operation": "kill",
  "hostId": "fixture-local",
  "meshRevision": null,
  "sessionRef": {
    "hostId": "fixture-local",
    "serverGeneration": "tmux-v1:1700000000:4321:/tmp/tmux-fixture/default",
    "sessionId": "$2",
    "createdAt": 1700000001
  },
  "guards": {
    "expectedName": "fixture",
    "requiredOptions": {}
  },
  "parameters": {}
}
